step,object,x,y,zoom,page,question,answer,alt_text,layer1_button,layer1_content,layer2_button,layer2_content,clip_start,clip_end,loop
paso,objeto,x,y,zoom,pagina,pregunta,respuesta,texto_alt,boton1,contenido1,boton2,contenido2,inicio_clip,fin_clip,bucle
1,4,0.5220832089108479,0.47956696634658913,1.4400000000000002,,Layer 1: Observation,"At 10:00 a.m. inside a UCSB lecture hall, dozens of students sat quietly, all facing the same direction and sharing their attention on the same lecture. Students were seated close together, and the room stayed calm and focused. No one spoke over the instructor.",,,,,,,,
2,4,0.5149644829026562,0.5126421159939353,2.0736,,Layer 2: Interpretation,This is community care: love expressed at the scale of a whole group rather than between two people. Quietly sharing a learning space and respecting each other’s focus is a small but real form of everyday kindness. Each student gives up a little noise and distraction for the benefit of everyone else. These almost invisible acts of consideration and respect are how a large community shows compassion and holds itself together.,,,,,,,,
3,4,0.5266633963557915,0.45133470815070087,2.9859839999999993,,"Layer 3: Connection to Reading ","This moment connects to Emily Esfahani Smith's ""The Secret to Love Is Just Kindness"" on a community scale. Smith argues that kindness is the foundation of strong relationships and grows through small, repeated acts. A lecture hall demonstrates this: dozens of students stay quiet, share space, and protect one another's concentration. Smith writes that ""the more someone receives or witnesses kindness, the more they will be kind themselves,"" creating what she calls ""upward spirals of love and generosity."" A quiet lecture hall works the same way; each student's small act of consideration is seen by others and quietly encourages them to do the same. The observation extends her idea from couples to communities, suggesting that the same everyday kindness that holds two people together can also hold a campus together.",,,,,,,,
4,4,0.5563492140229641,0.4603018372703406,1.44,,Hotspots,"1. All students facing one direction: Every student faces the same way, sharing attention on one speaker. A quiet, collective act of respect or kindness at the scale of a community.
2. Students seated close together: They share a crowded space without tension. Their ease shows the trust and consideration that Smith says small acts of kindness build.
3. The calm, quiet room: The hall stays calm even when full. That calm is created by dozens of people, each choosing quiet; an invisible, everyday kindness.
",,,,,,,,